Région siège	Département siège	Arrondissement siège	Commune siège	N° SIREN	Nom du groupement	Nature juridique	Syndicat à la carte	Groupement interdépartemental	Date de création	Date d'effet	Mode de répartition des sièges	Autre mode de répartition des sièges	Nombre de membres	Population	Nombre de compétences exercées	Mode de financement	Civilité Président	Prénom Président	Nom Président
32 - Hauts-de-France	59 - Nord	5 - Lille	215903501 - Lille	200093201	Métropole Européenne de Lille	METRO	0	0	2019-10-25	2020-03-14	RDC		95	1198654	58	FPU	M.	Damien	CASTELAIN	
32 - Hauts-de-France	59 - Nord	4 - Dunkerque	200027159 - Dunkerque	245900428	CU de Dunkerque	CU	0	0	1968-10-21	1968-10-21	RDC		17	195245	57	FPU	M.	Patrice	VERGRIETE	
32 - Hauts-de-France	59 - Nord	2 - Cambrai	215900630 - Beauvois-en-Cambrésis	200030633	CA du Caudrésis et du Catésis	CA	0	0	2011-12-23	2011-12-31	RDC		46	64366	38	FPU	M.	Serge	SIMÉON	
32 - Hauts-de-France	59 - Nord	4 - Dunkerque	215902958 - Hazebrouck	200040947	CA Coeur de Flandre	CA	0	0	2013-12-31	2013-12-31	RDC		50	104275	40	FPU	M.	Valentin	BELLEVAL	
32 - Hauts-de-France	59 - Nord	6 - Valenciennes	215906322 - Wallers	200042190	CA de la Porte du Hainaut	CA	0	0	2014-01-01	2014-01-01	RDC		47	159883	40	FPU	M.	Aymeric	ROBIN	
32 - Hauts-de-France	59 - Nord	1 - Avesnes-sur-Helpe	215903923 - Maubeuge	200043396	CA Maubeuge Val de Sambre	CA	0	0	2013-05-30	2013-12-31	ACCOR		43	124830	44	FPU	M.	Bernard	BAUDOUX	
32 - Hauts-de-France	59 - Nord	3 - Douai	215901786 - Douai	200044618	CA Douaisis Agglo	CA	0	0	2014-01-01	2014-01-01	RDC		35	150500	52	FPU	M.	Christian	POIRET	
32 - Hauts-de-France	59 - Nord	2 - Cambrai	215901224 - Cambrai	200068500	CA de Cambrai	CA	0	0	2017-01-01	2017-01-01	RDC		55	81786	48	FPU	M.	François-Xavier	VILLAIN	
32 - Hauts-de-France	59 - Nord	6 - Valenciennes	215906066 - Valenciennes	245901160	CA Valenciennes Métropole	CA	0	0	2000-12-22	2000-12-31	RDC		35	193856	45	FPU	M.	Laurent	DEGALLAIX	
32 - Hauts-de-France	59 - Nord	4 - Dunkerque	215900671 - Bergues	200040954	CC des Hauts de Flandre	CC	0	0	2013-12-31	2013-12-31	ACCOR		40	54594	38	FPU	M.	André	FIGOUREUX	
32 - Hauts-de-France	59 - Nord	5 - Lille	215904665 - Pont-à-Marcq	200041960	CC Pévèle-Carembault	CC	0	0	2013-12-31	2013-12-31	ACCOR		38	100011	34	FPU	M.	Luc	FOUTRY	
32 - Hauts-de-France	59 - Nord	1 - Avesnes-sur-Helpe	215900366 - Avesnes-sur-Helpe	200043263	CC Coeur de l'Avesnois	CC	0	0	2013-05-30	2013-05-30	ACCOR		43	29618	22	FPU	M.	Nicolas	DOSEN	
32 - Hauts-de-France	59 - Nord	1 - Avesnes-sur-Helpe	215904814 - Le Quesnoy	200043321	CC du Pays de Mormal	CC	0	0	2013-12-31	2013-12-31	ACCOR		53	49087	23	FPU	M.	Jean-Pierre	MAZINGUE	
32 - Hauts-de-France	59 - Nord	1 - Avesnes-sur-Helpe	215902495 - Fourmies	200043404	CC du Sud Avesnois	CC	0	0	2013-05-30	2013-12-31	ACCOR		12	24862	18	FPU	M.	Mickaël	HIRAUX	
32 - Hauts-de-France	59 - Nord	4 - Dunkerque	215902685 - La Gorgue	245900758	CC Flandre Lys	CC	0	1	1992-12-30	1992-12-30	ACCOR		8	40508	32	FPU	M.	Jacques	HURLUS	
32 - Hauts-de-France	59 - Nord	2 - Cambrai	215905712 - Solesmes	245901038	CC du Pays Solesmois	CC	0	0	1994-11-23	2010-03-09	ACCOR		15	14918	30	FPU	M.	Paul	SAGNIEZ	
32 - Hauts-de-France	59 - Nord	3 - Douai	215903451 - Lewarde	245901152	CC Coeur d'Ostrevent (CCCO)	CC	0	0	2000-12-26	2000-12-26	ACCOR		20	71293	34	FPU	M.	Frédéric	DELANNOY	
32 - Hauts-de-France	59 - Nord	2 - Cambrai	215901398 - Caudry	200000230	SIVU murs mitoyens du Cambrésis	SIVU	0	0	2005-11-02	2005-11-02	AUTR	collège de communes	80	138475	1	CBUDG	M.	Daniel	POTEAU	
32 - Hauts-de-France	59 - Nord	6 - Valenciennes	215900143 - Anzin	200036770	Nouveau SI distribution d'énergie électrique et de gaz dans l'arrondissement de Valenciennes	SIVU	0	0	2012-09-11	2013-01-01	MEMNB		82	353739	1	CBUFI	M.	Pierre-Michel	BERNARD	
32 - Hauts-de-France	59 - Nord	6 - Valenciennes	215901141 - Bruille-Saint-Amand	200036804	SIVU "Petite enfance les 4 Châtons"	SIVU	0	0	2012-12-14	2013-01-01	MEMNB		3	3964	1	CBUDG	M.	Christophe	PANNIER	
32 - Hauts-de-France	59 - Nord	6 - Valenciennes	215905548 - Sars-et-Rosières	200039881	SI de la vallée de la Scarpe	SIVU	0	0	2013-08-26	2013-10-01	MEMNB		7	9744	4	CBUDG	M.	Jean-Claude	MESSAGER	
32 - Hauts-de-France	59 - Nord	2 - Cambrai	215905936 - Thun-l'Évêque	200040988	SIVU aide à la personne	SIVU	0	0	2013-11-01	2013-11-01	MEMNB		11	13450	1	CBUDG	M.	Jacques	DENOYELLE	
32 - Hauts-de-France	59 - Nord	5 - Lille	215902990 - Hem	200062909	SI du Val de Marque	SIVU	0	0	2016-06-20	2016-06-20	MEMNB		6	51119	1	CBUDG	M.	Francis	VERCAMER	
32 - Hauts-de-France	59 - Nord	5 - Lille	215903527 - Linselles	200074433	Relais enfance	SIVU	0	0	2017-01-02	2017-01-02	MEMNB		4	28429	1	CBUDG	Mme	Isabelle	POLLET	
32 - Hauts-de-France	59 - Nord	6 - Valenciennes	215905043 - Roeulx	200090496	SI d'assainissement des communes de Roeulx, Abscon, Mastaing et Emerchicourt	SIVU	0	0	2019-08-22	2019-08-22	MEMNB		4	9793	2	CBUDG	M.	Charles	LEMOINE	
32 - Hauts-de-France	59 - Nord	5 - Lille	215905993 - Tourcoing	200102192	SIVU pour la création et la gestion de la fourrière pour animaux errants	SIVU	0	0	2023-08-01	2023-08-01	POPUL		80	602361	1	CBUDG	Mme	Brigitte	LHERBIER	
32 - Hauts-de-France	59 - Nord	6 - Valenciennes	215906033 - Trith-Saint-Léger	245900287	SIVU "Comité des Agés du Pays Trithois"	SIVU	0	0	1972-10-13	2010-04-09	MEMNB		16	56444	2	CBUDG	Mme	Isabelle	CHOAIN	
32 - Hauts-de-France	59 - Nord	6 - Valenciennes	215904848 - Quiévrechain	245900303	Syndicat intercommunal de la Vallée de l'Aunelle et de l'Hogneau	SIVU	0	0	1973-02-09	2010-03-01	MEMNB		4	11961	1	CBUDG	M.	Pierre	GRINER	
32 - Hauts-de-France	59 - Nord	5 - Lille	215905860 - Templeuve-en-Pévèle	245900378	SI du Pévèle Mélantois (SIPEM)	SIVU	0	0	1972-11-27	1972-11-28	POPUL		23	59408	1	CBUDG	M.	Francis	MELON	
32 - Hauts-de-France	59 - Nord	2 - Cambrai	215906314 - Walincourt-Selvigny	255900334	SI pour la gestion d'un CES de Walincourt-Selvigny	SIVU	0	0	1970-11-23	1970-11-23	MEMNB		11	11263	2	CBUDG	M.	Jérôme	MELI	
32 - Hauts-de-France	59 - Nord	2 - Cambrai	215903220 - Iwuy	255900375	SI pour la construction et la gestion communautaire du CES d'Iwuy	SIVU	0	0	1974-09-17	1974-09-17	MEMNB		6	6822	3	CBUDG	M.	Gérard	POULAIN	
32 - Hauts-de-France	59 - Nord	3 - Douai	215903147 - Hornaing	255900458	SI pour la gestion du centre de vacances "Les Grangettes" à Malbuisson 	SIVU	0	0	1979-09-11	1979-09-11	MEMNB		10	78786	1	CBUDG	M.	Emile	BRICE	
32 - Hauts-de-France	59 - Nord	5 - Lille	215902990 - Hem	255900730	SI des Trois Villes	SIVU	0	0	1972-09-06	1972-09-06	AUTR		3	132112	1	CBUDG	M.	Francis	MENAGER	
32 - Hauts-de-France	59 - Nord	2 - Cambrai	215901224 - Cambrai	255901035	SI d'assainissement de l'agglomération cambrésienne (SIAC)	SIVU	0	0	1967-03-24	1967-03-24	POPUL		8	45968	2	CBUDG	M.	Jean-Marie	DEVILLERS	
32 - Hauts-de-France	59 - Nord	6 - Valenciennes	215901729 - Denain	255901183	SI d'assainissement et d'évacuation des eaux pluviales de la région de Denain (SIAD)	SIVU	0	0	1963-11-05	1963-11-05	MEMNB		6	39807	2	CBUDG	Mme	Anne-Lyse	DUFOUR-TONINI	
32 - Hauts-de-France	59 - Nord	6 - Valenciennes	215903139 - Hordain	255901225	Syndicat d'assainissement entre les communes d'Avesnes-le-Sec, Bouchain, Hordain et Lieu-Saint-Amand	SIVU	0	0	1971-07-23	2010-03-01	MEMNB		4	8422	2	CBUDG	M.	Arnaud	BAVAY	
32 - Hauts-de-France	59 - Nord	5 - Lille	215902867 - Haubourdin	255901415	SI pour la construction et la gestion d'équipements sportifs et de plein air	SIVU	0	0	1970-04-07	1970-04-07	MEMNB		2	38135	1	CFISC	M.	Pierre	BEHARELLE	
32 - Hauts-de-France	59 - Nord	4 - Dunkerque	215906686 - Zuydcoote	255901506	SI des Dunes de Flandre	SIVU	0	0	1980-06-24	1980-06-24	MEMNB		4	98331	2	CBUDG	M.	Frédéric	VANHILLE	
32 - Hauts-de-France	59 - Nord	3 - Douai	215903345 - Lauwin-Planque	255901605	SI pour l'aide à l'enfance inadaptée (SICAEI)	SIVU	0	0	1966-05-04	1966-05-04	MEMNB		63	245254	2	CBUDG	M.	Jean-Jacques	PEYRAUD	
32 - Hauts-de-France	59 - Nord	5 - Lille	215902867 - Haubourdin	255901647	SI pour l'accueil et l'information des personnes privées d'emploi	SIVU	0	0	1989-02-20	2010-03-05	MEMNB		23	97120	1	CBUDG	M.	Pierre	BEHARELLLE	
32 - Hauts-de-France	59 - Nord	5 - Lille	215902867 - Haubourdin	255901712	SIVU pour le développement de la qualité de la vie des personnes du 3ème et 4ème âge	SIVU	0	0	1982-03-29	1982-03-29	MEMNB		5	33217	1	CBUDG	Mme	Béatrice	IDZIOREK	
32 - Hauts-de-France	59 - Nord	5 - Lille	215903501 - Lille	255901761	SI pour la création et la gestion de la fourrière pour animaux errants de Lille et environs	SIVU	0	0	1982-12-12	2010-03-05	MEMNB		39	656849	1	CBUDG	Mme	Christelle	LIBERT	
32 - Hauts-de-France	59 - Nord	2 - Cambrai	215900630 - Beauvois-en-Cambrésis	255901878	SI d'aménagement du territoire et d'urbanisme de Beauvois-en-Cambrésis (SIATUB)	SIVU	0	0	1985-02-20	1985-02-20	MEMNB		5	5294	1	AUCUN	M.	Yannick	HERBET	
32 - Hauts-de-France	59 - Nord	3 - Douai	215903147 - Hornaing	255902124	SI pour la gestion du fonctionnement scolaire de la piscine d'Hornaing 	SIVU	0	0	1989-03-01	1989-03-01	MEMNB		16	46755	3	CBUDG	Mme	Vanessa	DE BOER	
32 - Hauts-de-France	59 - Nord	4 - Dunkerque	200027159 - Dunkerque	255902223	SIVU pour la télédistribution	SIVU	0	0	1991-06-17	1991-06-17	MEMNB		3	117011	1	CBUDG	M.	Benoît	VANDEWALLE	
32 - Hauts-de-France	59 - Nord	5 - Lille	215905126 - Roubaix	255902231	SIVU Thalassa	SIVU	0	0	1991-01-24	2010-03-09	MEMNB		2	120376	1	CFISC	M.	Michel	GACEM	
32 - Hauts-de-France	59 - Nord	5 - Lille	215905076 - Ronchin	255902256	SIVU pour l'étude, la création, la promotion, l'aménagement et la gestion du centre de loisirs du Camp Français	SIVU	0	0	1991-04-04	1991-04-04	POPUL		4	270481	1	CBUDG	M.	Patrick	GEENENS	
32 - Hauts-de-France	59 - Nord	1 - Avesnes-sur-Helpe	215902495 - Fourmies	255902413	SI d'assainissement de Fourmies-Wignehies	SIVU	0	0	1993-05-05	1993-05-05	MEMNB		2	14471	2	CBUDG	M.	Maxence	SIMPERE	
32 - Hauts-de-France	59 - Nord	2 - Cambrai	215900630 - Beauvois-en-Cambrésis	255902421	SI pour l'aménagement du "Val du Riot"	SIVU	0	0	1993-10-05	1993-10-05	MEMNB		2	16196	1	CBUDG	M.	Frédéric	BRICOUT	
32 - Hauts-de-France	59 - Nord	5 - Lille	215902206 - Faches-Thumesnil	255902520	SIVU pour l'insertion sociale et professionnelle	SIVU	0	0	1995-10-25	1995-10-25	MEMNB		8	84068	1	CBUDG	M.	Marc	GODEFROY	
32 - Hauts-de-France	59 - Nord	5 - Lille	215900119 - Annoeullin	255902579	SI pour la construction d'une gendarmerie	SIVU	0	0	1996-12-06	2010-09-22	MEMNB		6	26575	1	CBUDG	M.	Philippe	PARSY	
32 - Hauts-de-France	59 - Nord	5 - Lille	215900176 - Armentières	255902629	Syndicat de communes pour la construction et l'exploitation d'une piscine dans l'agglomération armentièroise (SCEPAA)	SIVU	0	0	1998-04-17	1998-04-17	MEMNB		5	55816	1	CBUDG	M.	Bernard	HAESEBROECK	
32 - Hauts-de-France	59 - Nord	5 - Lille	215900523 - Bauvin	255902678	SI de l'îlot de la Haute-Deûle	SIVU	0	1	1998-12-03	2010-03-09	MEMNB		2	10150	1	CBUDG	M.	Didier	RICHARD	
32 - Hauts-de-France	59 - Nord	5 - Lille	215903436 - Lesquin	255902694	SIVU pour l'aménagement et l'entretien du centre d'activités de Lesquin, Fretin et Sainghin-en-Mélantois	SIVU	0	0	1999-02-18	2010-03-09	MEMNB		3	15475	1	CBUDG	M.	Jean-Marc	AMBROZIEWICZ	
32 - Hauts-de-France	59 - Nord	1 - Avesnes-sur-Helpe	215900416 - Bachant	255902843	SI pour la gestion du groupe scolaire Sémard	SIVU	0	0	2002-03-28	2002-03-28	MEMNB		3	13771	1	CBUDG	Mme	Angélique	GUYOT	
32 - Hauts-de-France	59 - Nord	2 - Cambrai	215902941 - Haynecourt	255902876	SIVU "RPI Haynecourt, Blécourt, Sancourt"	SIVU	0	0	2002-09-02	2002-09-02	MEMNB		3	826	1	CBUDG	M.	Bernard	HUREZ	
32 - Hauts-de-France	59 - Nord	2 - Cambrai	215905670 - Séranvillers-Forenville	255902900	SIVU "RPI les Hauts Cambrésis"	SIVU	0	0	2002-12-20	2002-12-20	MEMNB		3	1314	1	CBUDG	Mme	Sabine	MACHU	
32 - Hauts-de-France	59 - Nord	5 - Lille	215903675 - Lys-lez-Lannoy	255902942	SIVU de l'école "Le Petit Prince"	SIVU	0	0	2004-04-22	2004-04-23	MEMNB		2	15737	1	CBUDG	M.	Michel	COLIN	
32 - Hauts-de-France	59 - Nord	2 - Cambrai	215905951 - Thun-Saint-Martin	200019263	SI pour l'énergie de Cambrai-Est	SIVOM	1	0	2009-01-15	2009-01-15	MEMNB		5	5529	2	AUCUN	M.	Henri	DESPRES	
32 - Hauts-de-France	59 - Nord	4 - Dunkerque	215902958 - Hazebrouck	200036895	SI d'énergie des communes de Flandre (SIECF)	SIVOM	1	1	1966-06-24	1966-06-24	MEMNB		99	203557	4	CBUDG	M.	Michel	DECOOL	
32 - Hauts-de-France	59 - Nord	4 - Dunkerque	215902735 - Gravelines	200040103	SIVOM des rives de l'Aa et de la Colme	SIVOM	1	0	2013-12-31	2013-12-31	POPUL		18	40044	5	CBUFI	M.	Bertrand	RINGOT	
32 - Hauts-de-France	59 - Nord	2 - Cambrai	215901679 - Cuvillers	200043446	SIVOM d'action sociale de l'Ouest Cambrésis	SIVOM	0	0	2013-11-28	2013-12-01	MEMNB		8	3119	4	CBUDG	Mme	Françoise	LAINE	
32 - Hauts-de-France	59 - Nord	2 - Cambrai	215902693 - Gouzeaucourt	200067098	SIVOM La Vacquerie	SIVOM	0	0	2016-10-27	2016-11-01	POPUL		6	5771	3	CBUDG	M.	Jacques	RICHARD	
32 - Hauts-de-France	59 - Nord	5 - Lille	215900119 - Annoeullin	200092906	Fédération d'électricité de l'arrondissement de Lille	SIVOM	1	0	2019-01-01	2019-01-01	POPUL		13	24344	1	CBUDG	M.	Jean-Claude	FLINOIS	
32 - Hauts-de-France	59 - Nord	2 - Cambrai	215901497 - Clary	245900055	SIVOM de la Warnelle	SIVOM	1	0	1975-03-27	2010-03-01	MEMNB		8	9152	2	CBUDG	M.	Alain	GOETGHELUCK	
32 - Hauts-de-France	59 - Nord	2 - Cambrai	215905332 - Saint-Hilaire-lez-Cambrai	245900071	SIVOM d'Avesnes-les-Aubert	SIVOM	0	0	1972-07-05	1972-07-05	MEMNB		10	16843	3	CBUFI	M.	Daniel	BLAIRON	
32 - Hauts-de-France	59 - Nord	5 - Lille	215903782 - Marcq-en-Baroeul	245900253	SIVOM Centre Métropole	SIVOM	0	0	1975-04-28	1975-04-28	POPUL		3	74468	2	CBUDG	Mme	Stéphanie	DUCRET	
32 - Hauts-de-France	59 - Nord	5 - Lille	215906116 - Verlinghem	245900261	SIVOM de Lompret-Pérenchies-Verlinghem	SIVOM	0	0	1977-09-12	1977-09-12	MEMNB		3	13541	1	CFISC	Mme	Héléne	MOENECLAEY	
32 - Hauts-de-France	59 - Nord	3 - Douai	215900150 - Arleux	245900402	SIVOM de la région d'Arleux (SIRA)	SIVOM	0	0	1958-11-12	1958-11-12	POPUL		15	15771	4	CBUDG	M.	Thierry	LEDENT	
32 - Hauts-de-France	59 - Nord	5 - Lille	215905274 - Saint-André-lez-Lille	245900451	SIVOM Alliance Nord-Ouest	SIVOM	1	0	1980-01-31	2010-03-09	POPUL		10	97889	8	CFISC	M.	Miguel	BEADES	
32 - Hauts-de-France	59 - Nord	5 - Lille	215900903 - Bondues	245901095	SI pour la gestion de l'aérodrome de loisir (SIGAL)	SIVOM	0	0	1996-10-01	1996-10-01	MEMNB		4	72129	1	CBUFI	M.	Patrick	DELEBARRE	
32 - Hauts-de-France	59 - Nord	5 - Lille	215905605 - Seclin	245901244	SIVOM du Grand Sud	SIVOM	1	0	1995-10-25	2010-03-09	MEMNB		15	38698	2	CBUDG	M.	Luc	MONNET	
32 - Hauts-de-France	59 - Nord	1 - Avesnes-sur-Helpe	215900366 - Avesnes-sur-Helpe	200008498	SM du SCOT Sambre-Avesnois	SMF	0	0	2007-03-27	2007-03-27	POPUL		4	228397	1	CBUDG	M.	Arnaud	DECAGNY	
32 - Hauts-de-France	59 - Nord	5 - Lille	215906462 - Wasquehal	200017598	SIDEN-SIAN	SMF	1	1	2008-11-21	2008-12-22	AUTR	Les délégués désignés par chaque membre sont regroupés géographiquement en collèges électoraux à raison d'un collège électoral par arrondissement pour le département du Nord et d'un collège électoral pour l'ensemble des départements limitrophes	570	831291	3	CBUDG	M.	Paul	RAOULT	
32 - Hauts-de-France	59 - Nord	2 - Cambrai	215905712 - Solesmes	200041895	SM du Sud-Est de l'Escaut (SYMSEE)	SMF	0	1	2013-01-10	2013-01-10	AUTR	Chaque EPCI-FP adhérent possède un nombre de délégués titulaires égal au nombre de communes pour lesquelles il adhère au syndicat;  Chaque EPCI-FP adhérent se verra attribuer un délégué titulaire supplémentaire, représentant de l'EPCI-FP	6	498914	5	CBUDG	M.	Georges	FLAMENGT	
32 - Hauts-de-France	59 - Nord	1 - Avesnes-sur-Helpe	215900366 - Avesnes-sur-Helpe	200043701	SM d'aménagement et d'entretien des cours d'eau de l'Avesnois	SMF	1	1	2013-05-30	2013-12-31	AUTR	CC Coeur avesnois : 38 délégués  CC Sambre Avesnois : 1 délégué  communes : 1 délégué	22	58168	2	AUCUN	M.	Alain	DELTOUR	
32 - Hauts-de-France	59 - Nord	1 - Avesnes-sur-Helpe	215900366 - Avesnes-sur-Helpe	200043727	Syndicat d'électricité de l'arrondissement d'Avesnes	SMF	0	0	2013-05-30	2013-12-31	POPUL		138	217278	1	CBUDG	M.	Guislain	CAMBIER	
32 - Hauts-de-France	59 - Nord	6 - Valenciennes	215906066 - Valenciennes	200046191	SM Escaut et affluents	SMF	0	1	2014-03-21	2014-03-21	AUTR	la répartition des sièges est fixée au prorata de la participation financière des membres	15	1175708	1	CBUDG	M.	Georges	FLAMENGT	
32 - Hauts-de-France	59 - Nord	6 - Valenciennes	215906066 - Valenciennes	200046639	SI de mobilité et d'organisation urbaine du Valenciennois	SMF	0	0	2014-04-22	2014-06-01	MEMNB		2	353739	3	CBUDG	M.	Guy	MARCHANT	
32 - Hauts-de-France	59 - Nord	4 - Dunkerque	215900432 - Bailleul	200074086	Union syndicale d'aménagement hydraulique du Nord (USAN)	SMF	1	1	2017-01-01	2017-01-01	AUTR	Collèges électoraux	36	299388	5	CBUDG	M.	JEAN-JACQUES	DEWYNTER	
32 - Hauts-de-France	59 - Nord	2 - Cambrai	215904285 - Neuville-Saint-Rémy	200093714	SM de l'Energie du Cambrésis	SMF	1	0	2020-01-01	2020-01-01	POPUL		110	201427	2	CBUDG	M.	Philippe	LOYEZ	
32 - Hauts-de-France	59 - Nord	3 - Douai	215902768 - Guesnain	255900441	SM des transports du Douaisis (SMTD)	SMF	0	0	1977-05-02	1977-05-02	POPUL		2	221793	8	CBUDG	M.	Claude	HEGO	
32 - Hauts-de-France	59 - Nord	4 - Dunkerque	200027159 - Dunkerque	255900508	Syndicat de l'eau du Dunkerquois	SMF	0	1	1961-04-18	1961-04-18	AUTR	CUD : 18 délégués  commues hors CUD : 1 délégué par commune	13	211698	2	CBUDG	M.	Bertrand	RINGOT	
32 - Hauts-de-France	59 - Nord	4 - Dunkerque	215902958 - Hazebrouck	255900573	SM de collecte et de traitement des ordures ménagères de la région des Flandres	SMF	1	0	1970-03-10	1970-03-10	POPUL		2	118983	1	CBUDG	M.	Philippe	BROUTEELE	
32 - Hauts-de-France	59 - Nord	4 - Dunkerque	215906637 - Wormhout	255900599	SM de ramassage des ordures ménagères Flandre - Nord	SMF	0	0	2002-10-03	2002-10-03	POPUL		2	80394	1	CBUDG	M.	Hervé	SAISON	
32 - Hauts-de-France	59 - Nord	6 - Valenciennes	215906066 - Valenciennes	255900938	SI de valorisation des déchets ménagers du Hainaut Valenciennois (ECOVALOR)	SMF	0	0	1973-02-14	2009-01-01	POPUL		2	208774	1	CBUDG	M.	Philippe	BAUDRIN	
32 - Hauts-de-France	59 - Nord	6 - Valenciennes	215901794 - Douchy-les-Mines	255900953	Syndicat inter-arrondissement de valorisation et d'élimination des déchets (SIAVED)	SMF	0	0	1973-04-13	1973-04-13	POPUL		3	295542	1	CBUDG	M.	Charles	LEMOINE	
32 - Hauts-de-France	59 - Nord	5 - Lille	215903501 - Lille	255902314	SM du SCOT de Lille Métropole	SMF	0	0	1991-10-24	2010-03-01	MEMNB		2	1298665	1	CBUDG	M.	Françis	VERCAMER	
32 - Hauts-de-France	59 - Nord	6 - Valenciennes	215904756 - Prouvy	255902603	SM "aéroport du Valenciennois - Charles Nungesser"	SMF	0	0	1997-11-17	2010-03-01	POPUL		2	353739	1	CBUDG	M.	Jacques	SCHNEIDER	
32 - Hauts-de-France	59 - Nord	6 - Valenciennes	215905266 - Saint-Amand-les-Eaux	255902637	Syndicat des milieux aquatiques et de la prévention des inondations de la vallée de la Scarpe-Aval et du Bas-Escaut	SMF	0	0	1965-03-31	1965-03-31	MEMNB		4	250989	5	CBUDG	M.	Marc	DELECLUSE	
32 - Hauts-de-France	59 - Nord	1 - Avesnes-sur-Helpe	215903923 - Maubeuge	255902652	SM de l'arrondissement d'Avesnes	SMF	0	0	1998-09-14	1998-09-14	POPUL		4	228397	1	CBUDG	M.	Arnaud	DECAGNY	
32 - Hauts-de-France	59 - Nord	4 - Dunkerque	200027159 - Dunkerque	255902660	SM pour le SCOT de la région Flandre Dunkerque	SMF	0	0	2002-06-06	2002-06-06	AUTR	CUD : 19 délégues  CC Huts de Flandre : 12 délégués	2	249839	2	CBUDG	M.	Martial	BAYAERT	
32 - Hauts-de-France	59 - Nord	1 - Avesnes-sur-Helpe	215903923 - Maubeuge	255902827	SM de transports urbains de la Sambre 	SMF	1	0	1962-05-11	2011-02-17	POPUL		3	127558	1	CBUDG	M.	Benoît	COURTIN	
32 - Hauts-de-France	59 - Nord	3 - Douai	215901786 - Douai	255902850	SM pour le SCOT du Grand Douaisis 	SMF	0	0	2002-05-13	2002-05-13	POPUL		2	221793	2	CBUDG	M.	LIONEL	COURDAVAULT	
32 - Hauts-de-France	59 - Nord	2 - Cambrai	215900630 - Beauvois-en-Cambrésis	255902884	SM d'aménagement du bassin de l'Erclin et des cours d'eau non domaniaux situés sur le territoire des membres du Syndicat (SMABE)	SMF	1	0	2002-10-09	2002-10-09	MEMNB		2	146152	7	CBUDG	M.	Yannick	HERBET	
32 - Hauts-de-France	59 - Nord	4 - Dunkerque	215902958 - Hazebrouck	255902934	SM Flandre et Lys	SMF	0	0	2003-06-17	2003-06-17	POPUL		2	144783	2	CBUDG	Mme	Danielle	MAMETZ	
32 - Hauts-de-France	59 - Nord	5 - Lille	215903501 - Lille	130004773	GECT ''Eurométropole Lille - Kortrijk - Tournai''	SMO	0	0	2008-01-21	2008-01-22	POPUL		2	2641207	1	CBUDG	M.	Rudy	DELMOTTE	
32 - Hauts-de-France	59 - Nord	5 - Lille	215903501 - Lille	200006120	SM de l'Aéroport de Lille Métropole	SMO	1	0	2006-11-27	2006-11-27	AUTR		2	1198654	1	CBUDG	M.	Christophe	COULON	
32 - Hauts-de-France	59 - Nord	4 - Dunkerque	200027159 - Dunkerque	200019776	GECT West-Vlaanderen / Flandre-Dunkerque-Côte d'Opale	SMO	0	1	2009-03-25	2009-03-25	MEMNB		4	195245	1	CBUDG	M.	Patrice	VERGRIETE	
32 - Hauts-de-France	59 - Nord	5 - Lille	215903501 - Lille	200023505	Hauts-de-France Mobilités	SMO	0	1	2009-12-17	2009-12-30	AUTR	défini par le comité syndical	33	4120909	1	CBUDG	M.	Franck	DHERSIN	
32 - Hauts-de-France	59 - Nord	6 - Valenciennes	215906066 - Valenciennes	200032118	SM ''Docks Seine Nord Europe / Escaut''	SMO	0	0	2012-04-27	2012-05-01	AUTR	CCI GRAND HAINAUT:7 sièges - CAVM : 3 sièges - CAPH : 3 sièges	3	353739	1	CBUDG	M.	Bruno	FONTAINE	
32 - Hauts-de-France	59 - Nord	5 - Lille	215903501 - Lille	200039386	Nord-Pas-de-Calais Numérique	SMO	0	1	2013-07-04	2013-07-04	AUTR	Région Nord-Pas-de-Calais : 10 délégués  Département du Nord : 5 délégués  Département du Pas-de-Calais : 5 délégués	3	4124157	1	CBUDG	M.	Christophe	COULON	
32 - Hauts-de-France	59 - Nord	2 - Cambrai	215901224 - Cambrai	200102036	SM des Ports intérieurs du Canal Seine-Nord-Europe	SMO	0	1	2023-08-11	2023-08-11	POPUL		6	205060	3	CBUDG				
32 - Hauts-de-France	59 - Nord	1 - Avesnes-sur-Helpe	215901984 - Eppe-Sauvage	255900011	SM de la station touristique départementale du Val Joly 	SMO	0	0	1977-02-18	2009-02-16	AUTR		8	4177	3	CBUDG	M.	Jean-Luc	PERAT	
32 - Hauts-de-France	59 - Nord	6 - Valenciennes	215905266 - Saint-Amand-les-Eaux	255900748	SM de gestion du Parc naturel régional Scarpe-Escaut	SMO	0	0	1968-12-11	2009-10-30	MEMNB		72	675543	1	CBUDG	M.	Grégory	LELONG	
32 - Hauts-de-France	59 - Nord	4 - Dunkerque	200027159 - Dunkerque	255902066	SM Dunkerque Neptune	SMO	0	0	1988-03-15	1988-03-15	AUTR	commune de Dunkerque : 6 délégués  Commuanuté Urbaine de Dunkeqrue : 4 délégués  Grand Port Maritime de Dunkerque : 2 délégués  	3	195245	1	CBUDG	M.	Gérard	GOURVIL	
32 - Hauts-de-France	59 - Nord	1 - Avesnes-sur-Helpe	215903840 - Maroilles	255902710	SM de gestion du Parc naturel régional de l'Avesnois	SMO	0	0	1999-03-22	1999-03-22	MEMNB		138	292763	1	CBUDG	M.	Guislain	CAMBIER	
32 - Hauts-de-France	59 - Nord	5 - Lille	215903501 - Lille	255902892	SM d'adduction des eaux de la Lys	SMO	0	1	2002-12-16	2010-11-04	MEMNB		2	4124157	1	CBUDG	M.	Jean-Claude	DISSAUX	
32 - Hauts-de-France	59 - Nord	5 - Lille	215903501 - Lille	255902918	SM des Parcs naturels régionaux du Nord-Pas-de-Calais	SMO	0	1	2002-12-27	2002-12-27	AUTR	3 sièges pour les syndicats mixtes membres et 10 sièges pour la Région	4	1495438	1	CBUDG	M.	Anthony	JOUVENEL	
32 - Hauts-de-France	59 - Nord	6 - Valenciennes	215906066 - Valenciennes	200075489	Pôle Métropolitain du Hainaut Cambrésis	POLEM	0	0	2017-05-03	2017-05-03	POPUL		9	743206	3	CBUDG	M.	Laurent	DEGALLAIX	
32 - Hauts-de-France	59 - Nord	4 - Dunkerque	215902958 - Hazebrouck	200088755	Pôle Métropolitain des Flandres	POLEM	0	0	2019-01-01	2019-01-01	POPUL		2	144783	2	CBUDG	M.	Valentin	BELLEVAL	
32 - Hauts-de-France	59 - Nord	2 - Cambrai	215901224 - Cambrai	200078681	PETR du Pays du Cambrésis	PETR	0	0	2017-12-21	2017-12-21	POPUL		3	161070	2	CBUDG	M.	Sylvain	TRANOY	
