Région siège	Département siège	Arrondissement siège	Commune siège	N° SIREN	Nom du groupement	Nature juridique	Syndicat à la carte	Groupement interdépartemental	Date de création	Date d'effet	Mode de répartition des sièges	Autre mode de répartition des sièges	Nombre de membres	Population	Nombre de compétences exercées	Mode de financement	Civilité Président	Prénom Président	Nom Président
11 - Île-de-France	91 - Essonne	1 - Étampes	219102233 - Étampes	200017846	CA Étampois Sud Essonne	CA	0	0	2008-12-16	2008-12-16	RDC		37	56374	41	FPU	M.	Johann	MITTELHAUSSER	
11 - Île-de-France	91 - Essonne	3 - Palaiseau	219104718 - Orsay	200056232	CA Communauté Paris-Saclay	CA	0	0	2015-10-02	2016-01-01	RDC		27	320051	44	FPU	M.	Grégoire	DE LASTEYRIE	
11 - Île-de-France	91 - Essonne	3 - Palaiseau	219105491 - Sainte-Geneviève-des-Bois	200057859	CA Coeur d'Essonne Agglomération	CA	0	0	2015-12-04	2016-01-01	RDC		21	208858	46	FPU	M.	Eric	BRAIVE	
11 - Île-de-France	91 - Essonne	2 - Évry	219101144 - Brunoy	200058477	CA Val d'Yerres Val de Seine	CA	0	0	2015-12-14	2016-01-01	ACCOR		9	178586	35	FPU	M.	François	DUROVRAY	
11 - Île-de-France	91 - Essonne	2 - Évry	200083525 - Évry-Courcouronnes	200059228	CA Grand Paris Sud Seine Essonne Sénart	CA	0	1	2015-12-15	2016-01-01	RDC		23	360248	51	FPU	M.	Michel	BISSON	
11 - Île-de-France	91 - Essonne	3 - Palaiseau	219101110 - Briis-sous-Forges	249100074	CC du Pays de Limours (CCPL)	CC	0	0	2001-12-17	2001-12-31	RDC		14	27699	34	FPU	Mme	Dany	BOYER	
11 - Île-de-France	91 - Essonne	2 - Évry	219104056 - Milly-la-Forêt	249100157	CC des 2 Vallées	CC	0	0	2001-12-24	2001-12-31	RDC		15	18884	23	FPU	M.	Pascal	SIMONNOT	
11 - Île-de-France	91 - Essonne	2 - Évry	219100450 - Ballancourt-sur-Essonne	249100546	CC du Val d'Essonne (CCVE)	CC	0	0	2002-12-11	2002-12-31	ACCOR		21	62779	30	FPU	M.	Patrick	IMBERT	
11 - Île-de-France	91 - Essonne	1 - Étampes	219102266 - Étréchy	249100553	CC Entre Juine et Renarde (CCEJR)	CC	0	0	2003-10-27	2003-10-31	ACCOR		16	28147	37	FPU	M.	Jean-Marc	FOUCHER	
11 - Île-de-France	91 - Essonne	1 - Étampes	219102001 - Dourdan	249100595	CC le Dourdannais en Hurepoix (CCDH)	CC	0	0	2005-11-22	2005-11-22	RDC		11	27410	26	FPU	M.	Rémi	BOYER	
11 - Île-de-France	91 - Essonne	1 - Étampes	219105111 - Pussay	200006492	SI des quatre rivières des portes de la Beauce	SIVU	0	0	2006-11-28	2006-11-28	MEMNB		4	5277	1	CBUDG	M.	Grégory	COURTAS	
11 - Île-de-France	91 - Essonne	3 - Palaiseau	219106895 - Wissous	200026532	Syndicat pour la valorisation de la Plaine de Montjean	SIVU	0	1	2010-09-23	2010-09-23	MEMNB		3	41663	1	CBUDG				
11 - Île-de-France	91 - Essonne	1 - Étampes	219100161 - Angerville	200072890	SI d'énergie du Grand Étampois	SIVU	0	0	2016-12-19	2017-01-01	MEMNB		36	55711	1	CBUDG	M.	Johann	MITTELHAUSSER	
11 - Île-de-France	91 - Essonne	2 - Évry	219104056 - Milly-la-Forêt	200083111	SI de musique des deux vallées	SIVU	0	1	2018-10-04	2018-10-04	MEMNB		13	18974	2	CFISC	M.	Claude	DUPERCHE	
11 - Île-de-France	91 - Essonne	3 - Palaiseau	219101565 - Cheptainville	259100089	SI assainissement de la région de Cheptainville	SIVU	0	0	1942-11-07	1942-11-07	MEMNB		6	18593	1	CBUDG	M.	Lionel	VAUDELIN	
11 - Île-de-France	91 - Essonne	3 - Palaiseau	219103124 - Igny	259100196	SI pour la gestion du CES Émile Zola d'Igny	SIVU	0	0	1978-12-04	1978-12-04	MEMNB		3	17436	1	CBUDG	Mme	Laetitia	HAMON	
11 - Île-de-France	91 - Essonne	3 - Palaiseau	219102498 - Forges-les-Bains	259100659	SI assainissement des communes de Pecqueuse, Limours, Forges-les-Bains, Briis-sous-Forges (SIA)	SIVU	0	0	1960-11-08	1960-11-08	MEMNB		4	14748	2	CBUDG	M.	Emmanuel	DASSA	
11 - Île-de-France	91 - Essonne	3 - Palaiseau	219103777 - Massy	259100733	SI pour l'enfance inadaptée (SIEI)	SIVU	0	0	1966-11-02	1966-11-02	MEMNB		15	235394	1	CBUDG	Mme	Véronique	ZELLER	
11 - Île-de-France	91 - Essonne	2 - Évry	219104056 - Milly-la-Forêt	259100840	SI assainissement de la vallée supérieure de l'École	SIVU	0	1	1969-03-25	1969-03-25	MEMNB		2	2626	2	CBUDG				
11 - Île-de-France	91 - Essonne	2 - Évry	219106911 - Yerres	259100865	SI pour la réalisation et le fonctionnement du CES Crosne - Yerres	SIVU	0	0	1969-08-12	1969-08-12	MEMNB		2	38534	1	CBUDG	M.	Michaël	DAMIATI	
11 - Île-de-France	91 - Essonne	3 - Palaiseau	219104718 - Orsay	259100949	SI pour la création et la gestion d'établissements pour personnes âgées (SIPA)	SIVU	0	0	1972-12-07	1972-12-07	MEMNB		4	74102	1	CBUDG	Mme	Ariane	WACHTHAUSEN	
11 - Île-de-France	91 - Essonne	1 - Étampes	219101300 - Chalo-Saint-Mars	259101152	SIRP de Chalo-Saint-Mars, Saint-Hilaire	SIVU	0	0	1979-05-31	1979-05-31	MEMNB		2	1461	1	CBUDG	Mme	Sylvie	BROUARD	
11 - Île-de-France	91 - Essonne	3 - Palaiseau	219103454 - Longjumeau	259101459	SI pour la gestion du gymnase du collège Pablo Picasso à Saulx-les-Chartreux	SIVU	0	0	1969-06-26	1969-06-26	POPUL		4	34805	1	CBUDG	M.	Jérémy	MARTIN	
11 - Île-de-France	91 - Essonne	3 - Palaiseau	219106929 - Les Ulis	259101483	SI pour la création et la gestion d'un cimetière et d'un crématorium aux Ulis (SICOMU)	SIVU	0	0	1978-01-31	1978-01-31	MEMNB		3	76922	2	CBUDG	M.	Clovis	CASSAN	
11 - Île-de-France	91 - Essonne	2 - Évry	219103868 - Mennecy	259101517	SI Ris-Orangis, Mennecy, Bondoufle (Lamoura ou équip. Soc. Evry)	SIVU	0	0	1967-01-06	1967-01-06	MEMNB		3	56948	1	CBUDG	Mme	Chantale	BELMON	
11 - Île-de-France	91 - Essonne	3 - Palaiseau	219103454 - Longjumeau	259101582	SI pour la construction et le fonctionnement d'une école intercommunale Champlan - Longjumeau	SIVU	0	0	1968-12-02	1968-12-02	MEMNB		2	23369	1	CBUDG	M.	Christian	LECLERC	
11 - Île-de-France	91 - Essonne	3 - Palaiseau	219104585 - Nozay	259101632	SI des eaux des communes du Nord-Est de l'Essonne	SIVU	0	0	1931-06-04	1931-06-04	MEMNB		6	35105	1	CBUDG				
11 - Île-de-France	91 - Essonne	1 - Étampes	219100351 - Authon-la-Plaine	259101749	SIRP d'Authon-la-Plaine, Mérobert, Plessis-Saint-Benoist, Saint-Escobille (AMPS)	SIVU	0	0	1983-06-28	1983-06-28	MEMNB		4	1840	1	CBUDG	M.	Nicolas	ANDRE	
11 - Île-de-France	91 - Essonne	1 - Étampes	219103306 - Lardy	259101764	SI pour la construction et la gestion d'une gendarmerie à Lardy	SIVU	0	0	1982-06-29	1982-06-29	MEMNB		9	20335	1	CBUDG	M.	Denis	MEUNIER	
11 - Île-de-France	91 - Essonne	1 - Étampes	219105442 - Saint-Cyr-la-Rivière	259101863	SIRP de la vallée de l'Éclimont	SIVU	0	0	1976-08-10	1976-08-10	MEMNB		5	1663	1	CBUDG	M.	Eric	MEYER	
11 - Île-de-France	91 - Essonne	1 - Étampes	219106291 - Valpuiseaux	259102093	SIRP des vallées	SIVU	0	0	1991-07-04	1991-07-04	MEMNB		3	1563	1	CBUDG	M.	Jean	PERTHUIS	
11 - Île-de-France	91 - Essonne	3 - Palaiseau	219106341 - Vaugrigneuse	259102168	SIVU de l'Orme	SIVU	0	0	1991-08-27	1991-08-27	MEMNB		2	2031	2	CBUDG	Mme	Thérèse	BLANCHIER	
11 - Île-de-France	91 - Essonne	1 - Étampes	219100989 - Boutervilliers	259102192	SI des 4 vallées	SIVU	0	0	1981-06-15	1981-06-15	MEMNB		4	2052	1	CBUDG	Mme	Carine	HOUDOUIN	
11 - Île-de-France	91 - Essonne	3 - Palaiseau	219105897 - Savigny-sur-Orge	259102218	SI pour l'étude et l'aide aux personnes en situation de handicap	SIVU	0	0	1993-07-13	1993-07-13	MEMNB		6	131391	1	CBUDG	Mme	Isabelle	AUFFRET	
11 - Île-de-France	91 - Essonne	3 - Palaiseau	219101615 - Chilly-Mazarin	259102382	SI de restauration municipale Massy-Chilly (SIRMC)	SIVU	0	0	1996-07-17	1996-07-17	POPUL		3	82230	1	CBUDG	Mme	Elisabeth	PHILIPPOTEAU	
11 - Île-de-France	91 - Essonne	2 - Évry	219101847 - Courdimanche-sur-Essonne	259102648	SI de la vallée de l'Essonne (SIVE)	SIVU	0	0	2002-04-02	2002-04-02	MEMNB		6	5092	1	CBUDG	M.	Alain	JOYEZ	
11 - Île-de-France	91 - Essonne	2 - Évry	219103595 - Maisse	259102671	SIVU de l'école maternelle Pomme de Pin (SIVUEMPP)	SIVU	0	0	2002-06-12	2002-06-12	MEMNB		2	3127	1	CBUDG	M.	Claude	DUVAL	
11 - Île-de-France	91 - Essonne	1 - Étampes	219102480 - La Forêt-Sainte-Croix	259102713	SIRP du plateau (SIRPP)	SIVU	0	0	2003-08-11	2003-08-11	MEMNB		8	1410	1	CBUDG	Mme	Huguette	DENIS	
11 - Île-de-France	91 - Essonne	3 - Palaiseau	219101227 - Bures-sur-Yvette	259102754	SI pour l'aménagement et l'entretien de la coulée verte de l'Yvette (SICOVY)	SIVU	0	0	2000-03-21	2000-03-21	POPUL		3	37500	1	CBUDG	Mme	Nathalie	BEAN	
11 - Île-de-France	91 - Essonne	2 - Évry	219105533 - Saint-Germain-lès-Corbeil	249100330	Syndicat Intercommunal Seine et Sénart (S.I.2S)	SIVOM	1	0	1984-03-14	1984-03-14	MEMNB		7	40868	6	CBUDG	M.	Dominique	VEROTS	
11 - Île-de-France	91 - Essonne	3 - Palaiseau	219104254 - Montlhéry	249100389	SI de la région de Monthléry (SIRM)	SIVOM	1	0	1970-02-18	1970-02-18	AUTR	selon les compétences déléguées	3	24154	1	CBUDG	M.	Claude	PONS	
11 - Île-de-France	91 - Essonne	3 - Palaiseau	219105384 - Saint-Aubin	249100488	SIVOM Saint-Aubin - Villiers-le-Bâcle (SIVISA)	SIVOM	0	0	1998-06-05	1998-06-05	MEMNB		2	1820	2	CBUDG	Mme	Déborah	MONGENDRE	
11 - Île-de-France	91 - Essonne	1 - Étampes	219102001 - Dourdan	259100253	SI de transports de la région de Dourdan	SIVOM	1	1	1963-08-16	1963-08-16	MEMNB		22	29138	2	CBUDG	M.	Laurent	LARREGAIN	
11 - Île-de-France	91 - Essonne	2 - Évry	219105145 - Quincy-sous-Sénart	259102549	SI de mutualisation de services (ex SIRU du quartier de la gare SNCF Boussy-Quincy)	SIVOM	1	0	1999-03-31	1999-03-31	MEMNB		2	17595	1	CBUFI	Mme	Christine	GARNIER	
11 - Île-de-France	91 - Essonne	2 - Évry	219105731 - Saint-Pierre-du-Perray	259102630	SI pour l'enfance et la jeunesse (SIPEJ ex ACETEL)	SIVOM	1	0	2001-12-21	2001-12-21	MEMNB		7	38320	2	CBUDG	Mme	Florence	LE BELLEC	
11 - Île-de-France	91 - Essonne	2 - Évry	219102738 - Gironville-sur-Essonne	259102655	SIVU du val d'Essonne (SIVUVE)	SIVOM	0	0	2002-04-02	2002-04-02	MEMNB		4	1965	3	CBUDG	M.	Alain	JOYEZ	
11 - Île-de-France	91 - Essonne	3 - Palaiseau	219105871 - Saulx-les-Chartreux	200059525	SMAH de la vallée de l'Yvette (SIAHVY)	SMF	1	1	2015-12-21	2015-12-21	MEMNB		43	8382209	10	CBUDG	M.	Michel	BARRET	
11 - Île-de-France	91 - Essonne	3 - Palaiseau	219106663 - Villejust	200062321	SM des ordures ménagères de la vallée de Chevreuse	SMF	0	1	2016-04-20	2016-06-01	MEMNB		2	209699	1	CBUDG	M.	Jean-François	VIGIER	
11 - Île-de-France	91 - Essonne	2 - Évry	219104080 - Moigny-sur-École	200066959	SIRTOM du Sud-Francilien	SMF	0	1	2016-10-21	2016-11-01	MEMNB		4	24157	1	CBUFI	M.	Pascal	SIMONNOT	
11 - Île-de-France	91 - Essonne	1 - Étampes	219104338 - Morigny-Champigny	200071264	Syndicat transport Sud Essonne	SMF	0	0	2016-12-01	2017-01-01	MEMNB		27	88646	3	CBUDG	M.	Guy	DESMURS	
11 - Île-de-France	91 - Essonne	2 - Évry	219101748 - Corbeil-Essonnes	200072908	SI d'aménagement, de rivières et du cycle de l'eau	SMF	1	1	2016-12-19	2017-01-01	MEMNB		45	424965	16	CBUDG	M.	Xavier	DUGOIN	
11 - Île-de-France	91 - Essonne	3 - Palaiseau	219102498 - Forges-les-Bains	200077139	Syndicat des eaux Ouest Essonne	SMF	1	0	2017-11-22	2017-11-22	MEMNB		16	38331	1	CBUDG	M.	Alain	DESOUTER	
11 - Île-de-France	91 - Essonne	2 - Évry	219103405 - Lisses	200077832	Syndicat pour l'innovation, le recyclage et l'énergie par les déchets et ordures ménagères (SIREDOM) - Agence Sud Francilienne pour l'énergie, les déchets et l'environnement	SMF	1	1	2018-01-01	2018-01-01	MEMNB		13	1036488	2	CBUDG	M.	Olivier	THOMAS	
11 - Île-de-France	91 - Essonne	2 - Évry	219106879 - Viry-Châtillon	200087740	Syndicat de l'Orge, de la Rémarde et de la Prédecelle (SyORP)	SMF	1	1	2019-01-01	2019-01-01	POPUL		34	478706	10	CBUDG	M.	François	CHOLLEY	
11 - Île-de-France	91 - Essonne	1 - Étampes	219104957 - Plessis-Saint-Benoist	200093136	Syndicat des eaux de la région du Plessis-Saint-Benoist	SMF	0	0	2020-01-01	2020-01-01	MEMNB		2	2677	1	CBUDG	M.	Jean-Pierre	JUBERT	
11 - Île-de-France	91 - Essonne	2 - Évry	200083525 - Évry-Courcouronnes	200099638	Eau du Sud Francilien	SMF	0	1	2023-01-01	2023-01-01	MEMNB		4	790468	1	CBUFI	M.	Michel	BISSON	
11 - Île-de-France	91 - Essonne	3 - Palaiseau	219106457 - Verrières-le-Buisson	259100170	SM assainissement de la vallée de la Bièvre (SIAVB)	SMF	1	1	1945-12-25	1945-12-25	AUTR	deux délégués titulaires par commune représentée	5	695460	6	CBUDG	M.	Francisque	VIGOUROUX	
11 - Île-de-France	91 - Essonne	3 - Palaiseau	219103777 - Massy	259100741	SM Massy-Antony-Hauts-de-Bièvre pour le chauffage urbain et le traitement des résidus ménagers (SIMACUR)	SMF	1	1	1969-04-22	1969-04-22	POPUL		4	263916	2	CBUDG	M.	Pierre	OLLIER	
11 - Île-de-France	91 - Essonne	2 - Évry	219104213 - Montgeron	259100857	SM pour l'assainissement et la gestion des eaux du bassin versant de l'Yerres (SYAGE)	SMF	1	1	2011-09-30	2011-09-30	MEMNB		51	8321053	8	CBUDG	M.	Romain	COLAS	
11 - Île-de-France	91 - Essonne	1 - Étampes	219102233 - Étampes	259101194	SM aménagement et entretien de la rivière de la Juine et de ses affluents	SMF	0	1	1959-11-04	1959-11-04	MEMNB		5	385979	4	CBUDG	Mme	Maryvonne	SIEBENALER	
11 - Île-de-France	91 - Essonne	3 - Palaiseau	219101037 - Brétigny-sur-Orge	259101814	SM secteur de Brétigny, Leudeville, Le Plessis-Pâté, Vert-le-Grand	SMF	0	0	1988-07-27	1988-07-27	MEMNB		2	35528	1	CBUDG	M.	Nicolas	MEARY	
11 - Île-de-France	91 - Essonne	1 - Étampes	219102233 - Étampes	259101988	SM d'élimination des déchets de la région d'Etampes (SEDRE)	SMF	0	0	1989-07-06	1989-07-06	MEMNB		2	22522	1	CBUDG	M.	Bernard	DIONNET	
11 - Île-de-France	91 - Essonne	3 - Palaiseau	219101052 - Breuillet	259102242	SM pour la gestion de l'habitat voyageur (SYMGHAV)	SMF	0	1	1994-04-18	1994-04-18	POPUL		9	533467	1	CBUDG	M.	Rémi	BOYER	
11 - Île-de-France	91 - Essonne	3 - Palaiseau	219105491 - Sainte-Geneviève-des-Bois	259102457	SM Orge-Yvette-Seine (SMOYS)	SMF	1	1	1922-05-20	1922-05-20	MEMNB		54	1098788	4	CBUDG	M.	Xavier	DUGOIN	
11 - Île-de-France	91 - Essonne	1 - Étampes	219100476 - Baulne	259102614	SM d'électricité du Gâtinais d'Ile-de-France (SIEGIF)	SMF	1	0	2001-07-04	2001-07-04	MEMNB		8	30425	7	CBUDG	M.	Lionel	VAUDELIN	
11 - Île-de-France	91 - Essonne	2 - Évry	219106317 - Varennes-Jarcy	259102705	SM de la vallée de l'Yerres et des Sénarts	SMF	1	1	1962-10-23	1962-10-23	MEMNB		17	184697	2	CBUDG	M.	Guy	GEOFFROY	
11 - Île-de-France	91 - Essonne	2 - Évry	200083525 - Évry-Courcouronnes	200066090	SMO Essonne Numérique	SMO	0	0	2016-10-11	2016-10-11	AUTR	Un collège "département" composé de 8 représentants + un collège "EPCI membres" composé d'un représentant par EPCI + un collège "EPCI associés" consultatif. Chaque membre du 1er et du 2ème collège dispose d'une voix délibérative + 1 suppléant.	7	221293	1	CBUDG	M.	Michel 	BOURNAT	
11 - Île-de-France	91 - Essonne	2 - Évry	219102019 - Draveil	259100337	SMO études, aménagement et gestion de la base de plein air et de loisirs de Draveil	SMO	0	1	1970-02-24	1970-02-24	AUTR		5	79127	1	CBUDG	M.	Thierry	BATTESTI	
11 - Île-de-France	91 - Essonne	1 - Étampes	219102233 - Étampes	259100378	SM de l'Ile de Loisirs d'Étampes	SMO	0	1	1971-11-18	1971-12-31	MEMNB		3	26721	1	CBUDG	M.	Gérard	HEBERT	
11 - Île-de-France	91 - Essonne	2 - Évry	219104056 - Milly-la-Forêt	259102564	SM aménagement et gestion du parc naturel régional du Gâtinais français (PNR)	SMO	0	1	1999-06-18	1999-06-18	AUTR		80	404938	3	CBUDG	M.	Jean-Jacques	BOUSSAINGAULT	
